<?xml version="1.0" encoding="ISO-8859-1"?>
<types xmlns:xsi="http://www.w3.org/2001/XMLSchema-instance"
	xsi:noNamespaceSchemaLocation="itemtypes.xsd">

	<!-- enums -->

	<enum name="HtmlLinkTarget" package="at.spot.itemtype.cms.enumeration">
		<description>Represents an HTML link target used.</description>
		<value code="BLANK" />
		<value code="SELF" />
		<value code="PARENT" />
		<value code="TOP" />
	</enum>

	<enum name="Orientation" package="at.spot.itemtype.cms.enumeration">
		<description>Defines the orientation, eg. for layouts.</description>
		<value code="TOP" />
		<value code="BOTTOM" />
		<value code="LEFT" />
		<value code="RIGHT" />
	</enum>

	<enum name="TemplateRenderEngine" package="at.spot.itemtype.cms.enumeration">
		<description>The render engine used to render cms items.</description>
		<value code="VELOCITY" />
		<value code="FREEMARKER" />
		<value code="JSP" />
	</enum>

	<!-- image media -->
	<type name="ImageMedia" extends="FileMedia" package="at.spot.core.model.media">
		<properties>
		</properties>
	</type>

	<!-- cms item types -->

	<type name="AbstractCmsItem" abstract="true" package="at.spot.itemtype.cms.model"
		extends="UniqueIdItem">
		<properties>
			<property name="catalog">
				<datatype class="Catalog" />
				<description>The content catalog of the item.</description>
				<modifiers unique="true" />
				<validators>
					<validator javaClass="javax.validation.constraints.NotNull" />
				</validators>
			</property>
			<property name="restrictions">
				<datatype class="java.util.List">
					<genericArgument class="CmsRestriction" />
				</datatype>
				<description>The restrictions evaluate if the current cms item should be rendered.</description>
			</property>
			<property name="onlyOneRestrictionMustApply">
				<datatype class="boolean" />
				<description>
					f set to true, only one restriction must evaluate to "show cms item" 
					for the item to be visible.
				</description>
			</property>
		</properties>
	</type>

	<type name="CmsRestriction" extends="AbstractCmsItem" package="at.spot.itemtype.cms.model">
		<properties>
			<property name="evaluator">
				<datatype class="java.lang.String" />
				<description>The spring bean id of the corresponding evaluator implementation.</description>
			</property>
			<property name="evaluatorScript">
				<datatype class="java.lang.String" />
				<description>The beanshell script that evaluates the cms item visibility.</description>
			</property>
		</properties>
	</type>

	<type name="AbstractCmsComponent" abstract="true" extends="AbstractCmsItem"
		package="at.spot.itemtype.cms.model">
		<properties>
			<property name="renderContextProvider">
				<datatype class="java.lang.String" />
				<description>
					The spring bean id of the context provider implementation.
				</description>
			</property>
			<property name="renderContextPreparationScript">
				<datatype class="java.lang.String" />
				<description>
					Beanshell code that is executed before the page rendering.
					It can be used to prepare the render context variables.
				</description>
			</property>
			<property name="content">
				<datatype class="java.lang.String" />
			</property>
			<property name="renderEngine">
				<datatype class="TemplateRenderEngine" />
				<validators>
					<validator javaClass="javax.validation.constraints.NotNull" />
				</validators>
			</property>
		</properties>
	</type>

	<type name="AbstractCmsContainerComponent" abstract="true"
		extends="AbstractCmsComponent" package="at.spot.itemtype.cms.model">
		<properties>
			<property name="contentSlots">
				<datatype class="java.util.List">
					<genericArgument class="ContentSlot" />
				</datatype>
			</property>
		</properties>
	</type>

	<type name="CmsComponent" extends="AbstractCmsComponent" package="at.spot.itemtype.cms.model">
		<properties>
		</properties>
	</type>

	<type name="ContentSlot" extends="AbstractCmsItem" package="at.spot.itemtype.cms.model">
		<properties>
			<property name="cmsComponents">
				<datatype class="java.util.Map">
					<genericArgument class="java.lang.String" />
					<genericArgument class="CmsComponent" />
				</datatype>
			</property>
		</properties>
	</type>

	<type name="CmsPageTemplate" extends="AbstractCmsContainerComponent"
		package="at.spot.itemtype.cms.model">
		<properties>
			<property name="title">
				<datatype class="at.spot.core.infrastructure.type.LocalizedString" />
			</property>
			<property name="favIconPath">
				<datatype class="at.spot.core.infrastructure.type.LocalizedString" />
			</property>
			<property name="favIcon">
				<datatype class="ImageMedia" />
			</property>
			<property name="metaTags">
				<datatype class="java.util.Map">
					<genericArgument class="java.lang.String" />
					<genericArgument class="at.spot.core.infrastructure.type.LocalizedString" />
				</datatype>
			</property>
		</properties>
	</type>

	<type name="CmsPage" extends="CmsPageTemplate" package="at.spot.itemtype.cms.model">
		<properties>
			<property name="urlMatches">
				<datatype class="java.util.List">
					<genericArgument class="java.lang.String" />
				</datatype>
				<description>Holds the regex string to determine which URL should be handler by this page.</description>
			</property>
			<property name="template">
				<datatype class="CmsPageTemplate" />
			</property>
		</properties>
	</type>

	<!-- special cms components -->

	<type name="AbstractNavigationEntry" abstract="true" extends="CmsComponent"
		package="at.spot.itemtype.cms.model">
		<properties>
			<property name="name">
				<datatype class="java.lang.String" />
				<description>The navigation entry name.</description>
			</property>
		</properties>
	</type>

	<type name="NavigationLinkEntry" extends="AbstractNavigationEntry"
		package="at.spot.itemtype.cms.model">
		<properties>
			<property name="href">
				<datatype class="java.lang.String" />
				<description>The href of the link.</description>
			</property>
			<property name="target">
				<datatype class="HtmlLinkTarget" />
				<description>The HTML link target.</description>
			</property>
		</properties>
	</type>

	<type name="AbstractNavigationContainer" abstract="true"
		package="at.spot.itemtype.cms.model">
		<properties>
			<property name="entries">
				<datatype class="java.util.List">
					<genericArgument class="NavigationLinkEntry" />
				</datatype>
				<description>A list of all navigation link.</description>
			</property>
		</properties>
	</type>

	<type name="NavigationBar" extends="AbstractNavigationContainer"
		package="at.spot.itemtype.cms.model" />

	<type name="Footer" extends="AbstractNavigationContainer" package="at.spot.itemtype.cms.model" />

</types>