<?xml version="1.0" encoding="ISO-8859-1"?>
<types xmlns:xsi="http://www.w3.org/2001/XMLSchema-instance" xsi:noNamespaceSchemaLocation="itemtypes.xsd">

	<type name="Principal" abstract="true" package="at.spot.core.model.user">
		<description>The base type all user related item types.</description>
		<properties>
			<property name="uid" class="java.lang.String">
				<description>The unique id of the principal object.</description>
				<modifiers unique="true" />
			</property>
			<property name="shortName" class="java.lang.String">
				<description>The short name identifying the principal object.
				</description>
			</property>
		</properties>
	</type>

	<type name="User" typeCode="User" extends="Principal"
		package="at.spot.core.model.user">
		<properties>
			<property name="password" class="java.lang.String">
				<description>The login password, can be encrypted.</description>
				<accessors getter="true" setter="true" field="false" />
			</property>
			<property name="emailAddress" class="java.lang.String">
				<description>The main email address of the user.</description>
			</property>
		</properties>
	</type>

	<type name="Product" typeCode="Product" package="at.spot.commerce.catalog">
		<description>The base type Product is used for all purchasable items.
		</description>
		<properties>
			<property name="code" class="java.lang.String">
				<description>The unique code of the product.</description>
				<modifiers unique="true" />
			</property>
		</properties>
	</type>
</types>